[{"Id":"spiderman","Name":"Spider-Man","Description":"Agile movement, lighter gravity, stronger jumps, and a short speed burst.","Enabled":true,"Stats":{"HealthMultiplier":1.0,"ArmorMultiplier":1.0,"MovementSpeedMultiplier":1.25,"GravityMultiplier":0.7,"JumpMultiplier":1.45,"OutgoingDamageMultiplier":1.0,"IncomingDamageMultiplier":0.95,"MeleeDamageMultiplier":1.1,"RegenerationPerSecond":0},"Ability":{"Kind":"SpeedBurst","CooldownSeconds":18,"DurationSeconds":3,"Magnitude":1.35,"Radius":0,"VerticalBoost":0}},{"Id":"ironman","Name":"Iron Man","Description":"Durable armor-like resistance with temporary flight through noclip.","Enabled":true,"Stats":{"HealthMultiplier":1.2,"ArmorMultiplier":1.5,"MovementSpeedMultiplier":1.05,"GravityMultiplier":0.85,"JumpMultiplier":1.1,"OutgoingDamageMultiplier":1.1,"IncomingDamageMultiplier":0.85,"MeleeDamageMultiplier":1.0,"RegenerationPerSecond":0},"Ability":{"Kind":"Noclip","CooldownSeconds":30,"DurationSeconds":2,"Magnitude":1.0,"Radius":0,"VerticalBoost":0}},{"Id":"captainamerica","Name":"Captain America","Description":"Higher health, strong damage resistance, and a combat heal.","Enabled":true,"Stats":{"HealthMultiplier":1.25,"ArmorMultiplier":1.25,"MovementSpeedMultiplier":1.08,"GravityMultiplier":1.0,"JumpMultiplier":1.1,"OutgoingDamageMultiplier":1.05,"IncomingDamageMultiplier":0.8,"MeleeDamageMultiplier":1.25,"RegenerationPerSecond":0},"Ability":{"Kind":"SelfHeal","CooldownSeconds":30,"DurationSeconds":0,"Magnitude":25,"Radius":0,"VerticalBoost":0}},{"Id":"thor","Name":"Thor","Description":"High durability, stronger damage, and a thunder-like radial knockback.","Enabled":true,"Stats":{"HealthMultiplier":1.35,"ArmorMultiplier":1.1,"MovementSpeedMultiplier":1.0,"GravityMultiplier":0.85,"JumpMultiplier":1.15,"OutgoingDamageMultiplier":1.2,"IncomingDamageMultiplier":0.9,"MeleeDamageMultiplier":1.35,"RegenerationPerSecond":0},"Ability":{"Kind":"RadialKnockback","CooldownSeconds":25,"DurationSeconds":0,"Magnitude":450,"Radius":350,"VerticalBoost":0}},{"Id":"hulk","Name":"Hulk","Description":"Maximum health, huge melee damage, and a massive vertical leap.","Enabled":true,"Stats":{"HealthMultiplier":2.0,"ArmorMultiplier":1.0,"MovementSpeedMultiplier":0.9,"GravityMultiplier":1.0,"JumpMultiplier":1.3,"OutgoingDamageMultiplier":1.15,"IncomingDamageMultiplier":0.8,"MeleeDamageMultiplier":2.0,"RegenerationPerSecond":1},"Ability":{"Kind":"HighJump","CooldownSeconds":15,"DurationSeconds":0,"Magnitude":1.0,"Radius":0,"VerticalBoost":500}},{"Id":"wolverine","Name":"Wolverine","Description":"Fast regeneration, extra health, and devastating melee damage.","Enabled":true,"Stats":{"HealthMultiplier":1.3,"ArmorMultiplier":1.0,"MovementSpeedMultiplier":1.08,"GravityMultiplier":1.0,"JumpMultiplier":1.05,"OutgoingDamageMultiplier":1.05,"IncomingDamageMultiplier":0.9,"MeleeDamageMultiplier":1.5,"RegenerationPerSecond":4},"Ability":{"Kind":"SelfHeal","CooldownSeconds":25,"DurationSeconds":0,"Magnitude":30,"Radius":0,"VerticalBoost":0}},{"Id":"deadpool","Name":"Deadpool","Description":"Strong regeneration with a short movement burst.","Enabled":true,"Stats":{"HealthMultiplier":1.25,"ArmorMultiplier":1.0,"MovementSpeedMultiplier":1.1,"GravityMultiplier":1.0,"JumpMultiplier":1.05,"OutgoingDamageMultiplier":1.1,"IncomingDamageMultiplier":0.95,"MeleeDamageMultiplier":1.25,"RegenerationPerSecond":5},"Ability":{"Kind":"SpeedBurst","CooldownSeconds":20,"DurationSeconds":4,"Magnitude":1.25,"Radius":0,"VerticalBoost":0}},{"Id":"blackpanther","Name":"Black Panther","Description":"Fast, agile, resistant, and dangerous in melee.","Enabled":true,"Stats":{"HealthMultiplier":1.1,"ArmorMultiplier":1.2,"MovementSpeedMultiplier":1.3,"GravityMultiplier":0.9,"JumpMultiplier":1.2,"OutgoingDamageMultiplier":1.05,"IncomingDamageMultiplier":0.85,"MeleeDamageMultiplier":1.4,"RegenerationPerSecond":0},"Ability":{"Kind":"SpeedBurst","CooldownSeconds":18,"DurationSeconds":3,"Magnitude":1.35,"Radius":0,"VerticalBoost":0}},{"Id":"doctorstrange","Name":"Doctor Strange","Description":"Lighter movement and a short phase-walk through geometry.","Enabled":true,"Stats":{"HealthMultiplier":1.05,"ArmorMultiplier":1.0,"MovementSpeedMultiplier":1.0,"GravityMultiplier":0.8,"JumpMultiplier":1.1,"OutgoingDamageMultiplier":1.05,"IncomingDamageMultiplier":0.9,"MeleeDamageMultiplier":1.0,"RegenerationPerSecond":0},"Ability":{"Kind":"Noclip","CooldownSeconds":25,"DurationSeconds":1.5,"Magnitude":1.0,"Radius":0,"VerticalBoost":0}},{"Id":"scarletwitch","Name":"Scarlet Witch","Description":"Higher damage and a chaos field that heavily slows nearby enemies.","Enabled":true,"Stats":{"HealthMultiplier":1.0,"ArmorMultiplier":1.0,"MovementSpeedMultiplier":1.0,"GravityMultiplier":0.9,"JumpMultiplier":1.0,"OutgoingDamageMultiplier":1.2,"IncomingDamageMultiplier":0.95,"MeleeDamageMultiplier":1.0,"RegenerationPerSecond":0},"Ability":{"Kind":"RadialSlow","CooldownSeconds":30,"DurationSeconds":4,"Magnitude":0.45,"Radius":400,"VerticalBoost":0}},{"Id":"vision","Name":"Vision","Description":"Durable, light-gravity movement with temporary phasing.","Enabled":true,"Stats":{"HealthMultiplier":1.25,"ArmorMultiplier":1.2,"MovementSpeedMultiplier":1.0,"GravityMultiplier":0.65,"JumpMultiplier":1.15,"OutgoingDamageMultiplier":1.1,"IncomingDamageMultiplier":0.85,"MeleeDamageMultiplier":1.0,"RegenerationPerSecond":0},"Ability":{"Kind":"Noclip","CooldownSeconds":28,"DurationSeconds":2,"Magnitude":1.0,"Radius":0,"VerticalBoost":0}},{"Id":"antman","Name":"Ant-Man","Description":"Light, agile movement with a localized shrinking-style slow field.","Enabled":true,"Stats":{"HealthMultiplier":1.0,"ArmorMultiplier":1.0,"MovementSpeedMultiplier":1.15,"GravityMultiplier":0.75,"JumpMultiplier":1.2,"OutgoingDamageMultiplier":0.95,"IncomingDamageMultiplier":0.9,"MeleeDamageMultiplier":1.15,"RegenerationPerSecond":0},"Ability":{"Kind":"RadialSlow","CooldownSeconds":24,"DurationSeconds":3,"Magnitude":0.6,"Radius":250,"VerticalBoost":0}},{"Id":"wasp","Name":"Wasp","Description":"Very light gravity, fast movement, and a burst of speed.","Enabled":true,"Stats":{"HealthMultiplier":1.0,"ArmorMultiplier":1.0,"MovementSpeedMultiplier":1.3,"GravityMultiplier":0.55,"JumpMultiplier":1.35,"OutgoingDamageMultiplier":1.0,"IncomingDamageMultiplier":0.95,"MeleeDamageMultiplier":1.0,"RegenerationPerSecond":0},"Ability":{"Kind":"SpeedBurst","CooldownSeconds":18,"DurationSeconds":3,"Magnitude":1.4,"Radius":0,"VerticalBoost":0}},{"Id":"captainmarvel","Name":"Captain Marvel","Description":"High health, high damage, strong resistance, and a powerful shockwave.","Enabled":true,"Stats":{"HealthMultiplier":1.5,"ArmorMultiplier":1.25,"MovementSpeedMultiplier":1.15,"GravityMultiplier":0.6,"JumpMultiplier":1.25,"OutgoingDamageMultiplier":1.25,"IncomingDamageMultiplier":0.8,"MeleeDamageMultiplier":1.25,"RegenerationPerSecond":1},"Ability":{"Kind":"RadialKnockback","CooldownSeconds":25,"DurationSeconds":0,"Magnitude":550,"Radius":400,"VerticalBoost":0}},{"Id":"hawkeye","Name":"Hawkeye","Description":"Precision-focused outgoing damage with a temporary combat focus boost.","Enabled":true,"Stats":{"HealthMultiplier":1.0,"ArmorMultiplier":1.0,"MovementSpeedMultiplier":1.05,"GravityMultiplier":1.0,"JumpMultiplier":1.0,"OutgoingDamageMultiplier":1.2,"IncomingDamageMultiplier":1.0,"MeleeDamageMultiplier":1.0,"RegenerationPerSecond":0},"Ability":{"Kind":"DamageBoost","CooldownSeconds":25,"DurationSeconds":5,"Magnitude":1.35,"Radius":0,"VerticalBoost":0}},{"Id":"blackwidow","Name":"Black Widow","Description":"Fast movement and strong melee combat with a short acceleration burst.","Enabled":true,"Stats":{"HealthMultiplier":1.0,"ArmorMultiplier":1.0,"MovementSpeedMultiplier":1.2,"GravityMultiplier":0.95,"JumpMultiplier":1.1,"OutgoingDamageMultiplier":1.05,"IncomingDamageMultiplier":0.95,"MeleeDamageMultiplier":1.5,"RegenerationPerSecond":0},"Ability":{"Kind":"SpeedBurst","CooldownSeconds":20,"DurationSeconds":3,"Magnitude":1.3,"Radius":0,"VerticalBoost":0}},{"Id":"daredevil","Name":"Daredevil","Description":"Agility, resistance, and a short heightened-combat damage boost.","Enabled":true,"Stats":{"HealthMultiplier":1.05,"ArmorMultiplier":1.0,"MovementSpeedMultiplier":1.2,"GravityMultiplier":0.9,"JumpMultiplier":1.2,"OutgoingDamageMultiplier":1.05,"IncomingDamageMultiplier":0.9,"MeleeDamageMultiplier":1.35,"RegenerationPerSecond":0},"Ability":{"Kind":"DamageBoost","CooldownSeconds":24,"DurationSeconds":4,"Magnitude":1.3,"Radius":0,"VerticalBoost":0}},{"Id":"punisher","Name":"Punisher","Description":"More health and heavy outgoing weapon damage.","Enabled":true,"Stats":{"HealthMultiplier":1.2,"ArmorMultiplier":1.1,"MovementSpeedMultiplier":1.0,"GravityMultiplier":1.0,"JumpMultiplier":1.0,"OutgoingDamageMultiplier":1.3,"IncomingDamageMultiplier":0.95,"MeleeDamageMultiplier":1.1,"RegenerationPerSecond":0},"Ability":{"Kind":"DamageBoost","CooldownSeconds":28,"DurationSeconds":5,"Magnitude":1.4,"Radius":0,"VerticalBoost":0}},{"Id":"ghostrider","Name":"Ghost Rider","Description":"Durable offense with a fear-like slow aura.","Enabled":true,"Stats":{"HealthMultiplier":1.25,"ArmorMultiplier":1.0,"MovementSpeedMultiplier":1.1,"GravityMultiplier":1.0,"JumpMultiplier":1.0,"OutgoingDamageMultiplier":1.25,"IncomingDamageMultiplier":0.85,"MeleeDamageMultiplier":1.3,"RegenerationPerSecond":1},"Ability":{"Kind":"RadialSlow","CooldownSeconds":28,"DurationSeconds":4,"Magnitude":0.55,"Radius":350,"VerticalBoost":0}},{"Id":"storm","Name":"Storm","Description":"Light gravity and a wind blast that knocks enemies away.","Enabled":true,"Stats":{"HealthMultiplier":1.0,"ArmorMultiplier":1.0,"MovementSpeedMultiplier":1.15,"GravityMultiplier":0.6,"JumpMultiplier":1.25,"OutgoingDamageMultiplier":1.05,"IncomingDamageMultiplier":0.95,"MeleeDamageMultiplier":1.0,"RegenerationPerSecond":0},"Ability":{"Kind":"RadialKnockback","CooldownSeconds":22,"DurationSeconds":0,"Magnitude":500,"Radius":425,"VerticalBoost":0}},{"Id":"cyclops","Name":"Cyclops","Descripti